{
  "meta": {
    "tick": 0,
    "status": "running",
    "random_seed": 42
  },
  "hidden_state": {
    "clipboard_content": "",
    "correct_answer_hash": "",
    "active_downloads": [],
    "pending_notifications": [],
    "task_completion_criteria": {}
  },
  "ui": {
    "bid": "root",
    "tag": "desktop",
    "role": "application",
    "text": "Desktop",
    "z_index": 0,
    "bounds": {"x": 0, "y": 0, "width": 1920, "height": 1080},
    "children": [
      {
        "bid": "taskbar",
        "tag": "toolbar",
        "role": "toolbar",
        "text": "Taskbar",
        "z_index": 100,
        "bounds": {"x": 0, "y": 1040, "width": 1920, "height": 40},
        "children": [
          {
            "bid": "start_button",
            "tag": "button",
            "role": "button",
            "text": "Start",
            "bounds": {"x": 0, "y": 1040, "width": 50, "height": 40}
          },
          {
            "bid": "search_box",
            "tag": "input",
            "role": "searchbox",
            "text": "Search",
            "value": "",
            "bounds": {"x": 60, "y": 1045, "width": 200, "height": 30}
          },
          {
            "bid": "file_explorer_icon",
            "tag": "button",
            "role": "button",
            "text": "File Explorer",
            "bounds": {"x": 270, "y": 1040, "width": 40, "height": 40}
          },
          {
            "bid": "browser_icon",
            "tag": "button",
            "role": "button",
            "text": "Browser",
            "bounds": {"x": 320, "y": 1040, "width": 40, "height": 40}
          },
          {
            "bid": "system_tray",
            "tag": "group",
            "role": "group",
            "text": "System Tray",
            "bounds": {"x": 1800, "y": 1040, "width": 120, "height": 40},
            "children": [
              {
                "bid": "wifi_icon",
                "tag": "button",
                "role": "button",
                "text": "WiFi: Connected",
                "bounds": {"x": 1800, "y": 1045, "width": 30, "height": 30}
              },
              {
                "bid": "volume_icon",
                "tag": "button",
                "role": "button",
                "text": "Volume: 75%",
                "bounds": {"x": 1835, "y": 1045, "width": 30, "height": 30}
              },
              {
                "bid": "clock",
                "tag": "text",
                "role": "status",
                "text": "10:30 AM",
                "bounds": {"x": 1870, "y": 1045, "width": 50, "height": 30}
              }
            ]
          }
        ]
      },
      {
        "bid": "desktop_icons",
        "tag": "group",
        "role": "list",
        "text": "Desktop Icons",
        "z_index": 1,
        "bounds": {"x": 10, "y": 10, "width": 200, "height": 500},
        "children": [
          {
            "bid": "icon_documents",
            "tag": "button",
            "role": "button",
            "text": "Documents",
            "bounds": {"x": 10, "y": 10, "width": 80, "height": 80}
          },
          {
            "bid": "icon_downloads",
            "tag": "button",
            "role": "button",
            "text": "Downloads",
            "bounds": {"x": 10, "y": 100, "width": 80, "height": 80}
          },
          {
            "bid": "icon_trash",
            "tag": "button",
            "role": "button",
            "text": "Trash",
            "bounds": {"x": 10, "y": 190, "width": 80, "height": 80}
          },
          {
            "bid": "icon_settings",
            "tag": "button",
            "role": "button",
            "text": "Settings",
            "bounds": {"x": 10, "y": 280, "width": 80, "height": 80}
          }
        ]
      }
    ]
  },
  "filesystem": {
    "/home/user/Documents": {
      "type": "directory",
      "visible": true
    },
    "/home/user/Documents/notes.txt": {
      "type": "file",
      "content": "My personal notes\n\nTodo:\n- Buy groceries\n- Call mom\n- Finish report",
      "visible": true,
      "size": 64
    },
    "/home/user/Downloads": {
      "type": "directory",
      "visible": true
    },
    "/home/user/Desktop": {
      "type": "directory",
      "visible": true
    }
  },
  "tabs": [],
  "history": []
}
